{
  "id": "demo-style",
  "version": "0.1.0",
  "components": [
    { "id": "eyebrow-heading", "status": "core" },
    { "id": "rich-text", "status": "core" },
    { "id": "code-block", "status": "core" },
    { "id": "quiz-single", "status": "core" }
  ],
  "layouts": ["content-slide", "cover-hero", "cover-chapter", "cover-end"]
}
